{"schema_version":"demo-story.redhat-intel.com/virtualization-ai-501/operation-response/v1","request_id":"op-401-ai-dependency-outage","decision":"ABSTAIN","source_state":"REHEARSAL","reason_codes":["AI_DEPENDENCY_UNAVAILABLE"],"policy":{"id":"virtualization-ai-501-day-two","version":"0.1.0","matched_rules":["abstain-ai-dependency"]},"authority":{"human_review_required":true,"automated_action_performed":false,"llm_authority":"NONE"},"evidence":[{"schema_version":"demo-story.redhat-intel.com/virtualization-ai-501/evidence/v1","evidence_id":"evidence-401-outage","request_id":"op-401-ai-dependency-outage","state":"VALIDATE","kind":"VALIDATION","source":"operations-adapter","source_state":"REHEARSAL","observed_at":"2026-09-28T18:05:00Z","freshness":"FRESH","digest":"sha256:eeeeeeeeeeeeeeeeeeeeeeeeeeeeeeeeeeeeeeeeeeeeeeeeeeeeeeeeeeeeeeee","payload":{"decision":"ABSTAIN"}}],"validation":{"status":"INCOMPLETE","infrastructure":"PASS","application":"PASS","ai_dependency":"FAIL","correlation":"PASS"},"ai_participated":false,"explanation":null}
