{"schema_version":"demo-story.redhat-intel.com/virtualization-ai-501/operation-response/v1","request_id":"op-401-migration-healthy","decision":"ALLOW_REVIEW","source_state":"REHEARSAL","reason_codes":["VALIDATION_COMPLETE"],"policy":{"id":"virtualization-ai-501-day-two","version":"0.1.0","matched_rules":["allow-validated-review"]},"authority":{"human_review_required":true,"automated_action_performed":false,"llm_authority":"NONE"},"evidence":[{"schema_version":"demo-story.redhat-intel.com/virtualization-ai-501/evidence/v1","evidence_id":"evidence-401-approved","request_id":"op-401-migration-healthy","state":"LEARN","kind":"DECISION","source":"operations-adapter","source_state":"REHEARSAL","observed_at":"2026-09-28T18:05:00Z","freshness":"FRESH","digest":"sha256:dddddddddddddddddddddddddddddddddddddddddddddddddddddddddddddddd","payload":{"decision":"ALLOW_REVIEW"}}],"validation":{"status":"PASS","infrastructure":"PASS","application":"PASS","ai_dependency":"PASS","correlation":"PASS"},"ai_participated":false,"explanation":null}
